[
    {
        "id": "hooks_exitfee",
        "name": "Exitfee Hook",
        "description": "The exit fee hook",
        "addresses": {
            "11155111": ["0x2Aa9D4066DAe16ef001765efF2cA8F41Bde0b019"]
        }
    },
    {
        "id": "hooks_feetaking",
        "name": "Feetaking Hook",
        "description": "The fee taking hook",
        "addresses": {
            "11155111": ["0x790ae803b6c0467C6A4cbDc6d6d712DE34CfdB76"]
        }
    },
    {
        "id": "hooks_stablesurge",
        "name": "StableSurge Hook",
        "description": "The StableSurge Hook",
        "addresses": {
            "11155111": ["0x1adc55adb4caae71abb4c33f606493f4114d2091"]
        }
    }
]
